{"jobTitle": "Sales Account Manager - MDU ", "company": {"name": "Pinnacle Group, Inc.", "location": "Las Vegas Metropolitan Area"}, "location": "Las Vegas Metropolitan Area", "jobType": "Full-time", "employmentType": "Contract", "experienceLevel": "Associate", "salary": {"amount": "30/hr + Commission", "currency": "USD"}, "jobFunction": "Sales", "industry": "Telecommunications", "description": "Applicants must live in Market - Las Vegas, NV\nPrevious Fiber experience required\n\nAs a Sales Account Manager specializing in Multiple Dwelling Property Fiber Sales, your role involves managing a portfolio of accounts to achieve long-term success. You\u2019ll be responsible for developing positive relationships with clients, handling their individual needs, and generating new business using existing and potential customer networks. Your ability to resolve conflicts, provide timely solutions, and supervise account representatives will be crucial.\n\n1. Responsibilities: Manage a Portfolio of Accounts:\n\n* Oversee a group of accounts related to multiple dwelling properties.\n* Strive for long-term success by maintaining positive relationships with clients.\n\n2. Client Relationship Management:\n\n* Act as the primary point of contact for clients.\n* Address individual customer needs promptly.\n* Resolve conflicts effectively.\n\n3. Business Development:\n\n* Generate new business opportunities by leveraging existing and potential customer networks.\n* Identify sales prospects within the multiple dwelling property sector.\n\n4. Sales Reporting and Target Setting:\n\n* Regularly report on account status and transactions.\n* Set and track sales targets aligned with company objectives.\n* Monitor sales metrics, including quarterly results and annual forecasts.\n\n5. Continuous Improvement:\n\n* Suggest actions to enhance sales performance.\n* Identify growth opportunities within the market.\n* Requirements and Skills: Proven Work Experience:\n* Previous experience as a Fiber Sales Account Manager or Fiber Sales Account Executive.\n* Hands-on experience in sales.\n* Familiarity Microsoft Office Suite. Solid experience with MS Excel is required.\n* Supervisory Experience\n* Communication and Negotiation Skills:\n* Excellent communication and negotiation abilities.\n* Strong stakeholdering and planning skills.\n* Timely project delivery and responsiveness to inquiries.\n* Business Acumen:\n* Problem-solving attitude.\n* Ability to understand and analyze sales performance metrics.\n* Ability to anticipate responses and potential roadblocks ahead.\n* Education:\n* Minimum High School Diploma. Bachelor\u2019s degree in business administration, Marketing, or a relevant field is a plus.\n\nIf you\u2019re passionate about building successful, long-term client relationships and contributing to business growth, this role might be a great fit for you!\n\n\nPay Range: 30/hr + Commission\n\nThe specific compensation for this position will be determined by a number of factors, including the scope, complexity and location of the role as well as the cost of labor in the market; the skills, education, training, credentials and experience of the candidate; and other conditions of employment. Our full-time consultants have access to benefits including medical, dental, vision as well as 401K contributions", "responsibilities": "Manage a Portfolio of Accounts:\nOversee a group of accounts related to multiple dwelling properties.\nStrive for long-term success by maintaining positive relationships with clients.\n\nClient Relationship Management:\nAct as the primary point of contact for clients.\nAddress individual customer needs promptly.\nResolve conflicts effectively.\n\nBusiness Development:\nGenerate new business opportunities by leveraging existing and potential customer networks.\nIdentify sales prospects within the multiple dwelling property sector.\n\nSales Reporting and Target Setting:\nRegularly report on account status and transactions.\nSet and track sales targets aligned with company objectives.\nMonitor sales metrics, including quarterly results and annual forecasts.\n\nContinuous Improvement:\nSuggest actions to enhance sales performance.\nIdentify growth opportunities within the market.", "qualifications": {"required": "Previous experience as a Fiber Sales Account Manager or Fiber Sales Account Executive.\nHands-on experience in sales.\nFamiliarity Microsoft Office Suite. Solid experience with MS Excel is required.\nSupervisory Experience\nExcellent communication and negotiation abilities.\nStrong stakeholdering and planning skills.\nTimely project delivery and responsiveness to inquiries.\nProblem-solving attitude.\nAbility to understand and analyze sales performance metrics.\nAbility to anticipate responses and potential roadblocks ahead.", "preferred": "Minimum High School Diploma. Bachelor\u2019s degree in business administration, Marketing, or a relevant field is a plus."}, "skills": ["Fiber", "Sales", "Microsoft Office", "Excel", "Client Relationship Management", "Business Development", "Sales Reporting", "Target Setting", "Continuous Improvement", "Supervisory Experience", "Communication", "Negotiation", "Stakeholdering", "Planning", "Problem Solving", "Business Acumen"], "postedDate": "1 month ago", "benefits": "Our full-time consultants have access to benefits including medical, dental, vision as well as 401K contributions", "remoteWork": "No", "url": "https://www.linkedin.com/jobs/view/3934462585"}