{"jobTitle": "Client Solutions Manager", "company": {"name": "TikTok", "location": "Austin, TX"}, "location": "Austin, TX", "jobType": "Full-time", "employmentType": "Full-time", "experienceLevel": "Mid-Senior level", "jobFunction": "Sales", "industry": "Entertainment Providers", "description": "Company Overview:\n\nTikTok is the leading destination for short-form mobile video. At TikTok, our mission is to inspire creativity and bring joy. TikTok's global headquarters are in Los Angeles and Singapore, and its offices include New York, London, Dublin, Paris, Berlin, Dubai, Jakarta, Seoul, and Tokyo.\n\n<br/>\n\nWhy Join Us?\n\n<br/>\n\nCreation is the core of TikTok's purpose. Our platform is built to help imaginations thrive. This is doubly true of the teams that make TikTok possible.\n\nTogether, we inspire creativity and bring joy - a mission we all believe in and aim towards achieving every day.\n\nTo us, every challenge, no matter how difficult, is an opportunity; to learn, to innovate, and to grow as one team.\n\n<br/>\n\nStatus quo? Never. Courage? Always.\n\n<br/>\n\nAt TikTok, we create together and grow together. That's how we drive impact - for ourselves, our company, and the communities we serve\n\nJoin us\n\n<br/>\n\nAbout the Team & Job:\n\n<br/>\n\nAt TikTok, our Global Business Solutions (advertising) team plays a crucial role in generating revenue by promoting our advertising solutions, onboarding new clients, driving effective ad campaigns, and more. As the TikTok community grows at an unprecedented speed worldwide, our GBS team leads groundbreaking projects that are changing the landscape of the advertising industry in real-time. \n\n<br/>\n\nThis position sits within the SMB Growth team, which is a mid-market sales team that is part of the broader SMB sales organization. The focus of this team is to connect TikTok's vibrant and growing creators and users with the brands and businesses they know and love. We are looking for a sales & customer service-centric, analytically minded, and detail-oriented Client Solutions Manager (CSM) to join our SMB Growth Team. \n\n<br/>\n\nYou will partner with a Brand Partnerships Manager on your book of business to drive revenue by identifying opportunities and leveraging data and analytics to build a consultative solution for our customers. You will be focused on client education and will be a crucial member in meeting client business objectives. In addition to supporting advertisers, CSMs are tasked with providing thoughtful feedback and recommendations to key internal stakeholders. Success in this position requires a great focus on client service, ability to thrive in a rapidly changing work environment, and provide solutions for advertisers leveraging our unique ad product suite.\n\n<br/>\n\n The most successful candidates in this role will have media experience, a high degree of intellectual curiosity, and thrive in an environment where optimal solutions involve testing and learning. TikTok currently observes a hybrid working policy of 4 days in the office each week and 1 day working remotely. \n\n<br/>\n\nThis position is full-time and based out of our Austin, TX office.\n\n<br/>\n\nResponsibilities:\n\n<br/>\n\n- Act as a consultant to develop and grow client relationships with advertisers of all sizes\n- Create media plans that deliver against client KPIs\n- Monitor, analyze campaign performance and make proactive recommendations to improve results\n- Project manage complex media buys with multiple stakeholders, timelines, and assets\n- Support and work with Sales on pre-sale research and pitches\n- Serve as an external product expert, educating clients and agencies on TikTok ad solutions and best practices.\n- Manage measurement strategy and creative execution\n- Collaborate with cross-functional teams to ensure successful campaign executions and troubleshoot client issues\n- Collect marketplace feedback and insights to guide our advertising strategy and ad offerings\n\n<br/>\n\nQualifications\n\n<br/>\n\nMinimum Qualification:\n- Experience in an account management and/or client service role within digital marketing and/or advertising.\n\n<br/>\n\nPreferred Qualifications:\n- Experience with auction-based ad networks\n- Experience working directly with brand or performance advertisers, including agencies\n- Experience managing complex client and campaign issues\n- Experience analyzing campaign delivery, diagnosing and solving technical problems with product and engineering teams\n- Experience with ad verification partners (IAS, DV,MOAT)\n- Working knowledge of Excel\n- Exceptional verbal and written communication skills and ability to effectively translate technical language to non-technical stakeholders\n- Adaptability and strong problem-solving skills \n- Impeccable attention to detail and highly organized\n- Self-starter and motivated to learn\n- Passion for TikTok marketing, and up for the challenge of building something from the ground up.\n\n<br/>\n\nTikTok is committed to creating an inclusive space where employees are valued for their skills, experiences, and unique perspectives. Our platform connects people from across the globe and so does our workplace. At TikTok, our mission is to inspire creativity and bring joy. To achieve that goal, we are committed to celebrating our diverse voices and to creating an environment that reflects the many communities we reach. We are passionate about this and hope you are too.\n\n<br/>\n\nTikTok is committed to providing reasonable accommodations in our recruitment processes for candidates with disabilities, pregnancy, sincerely held religious beliefs or other reasons protected by applicable laws. If you need assistance or a reasonable accommodation, please reach out to us at https://shorturl.at/cdpT2", "postedDate": "1 week ago", "skills": ["Digital Marketing", "Advertising", "Account Management", "Client Service", "Media Planning", "Campaign Performance Analysis", "Project Management", "Sales", "Client Education", "Product Expertise", "Measurement Strategy", "Creative Execution", "Cross-Functional Collaboration", "Problem Solving", "Excel", "Communication", "Adaptability", "Organization", "Self-Starter", "TikTok Marketing"], "url": "https://www.linkedin.com/jobs/view/3971703231"}