{"jobTitle": "Business System Analyst", "company": {"name": "Webologix Global", "industry": "IT Services and IT Consulting", "size": "Not specified", "location": "Los Angeles, CA"}, "location": "Los Angeles, CA", "jobType": "Contract", "employmentType": "Contract", "experienceLevel": "Associate", "salary": {"amount": "Not specified", "currency": "Not specified"}, "jobFunction": "Information Technology", "industry": "IT Services and IT Consulting", "description": "Please Find the Below Job Description:- \n\nTitle:- Business System Analyst\n\nClient:- Webologix\n\nLocation:- Los Angeles, CA\n\nType:- Contract\n\nCandidate Must Have The Following Requirements And Experience\n\n- Familiarity with different web technologies (HTML, CSS, JavaScript), database systems (particularly SQL Server).\n- Ability to write basic SQL queries.\n- Familiarity with web frameworks and web APIs. Experience in how to test them (swagger, postman, etc.).\n- Mastery over Microsoft Office tools (Word, Excel, PowerPoint as a minimum).\n- Strong verbal and written communication skills are essential. This includes the ability to communicate technical information to non-technical stakeholders and to translate business needs into technical requirements.\n- Experience in wireframing system based on gathered business requirements.\n- Capability to diagnose issues and find creative solutions for technical and business challenges.\n- Knowledge of testing methodologies and tools to ensure the reliability and performance of web applications.\n- Experienced in writing business requirement documents, meeting minutes, and test scripts.\n\nDesirable Requirements\n\n- Knowledge of Dev Ops, in particular the project management aspect of it. Similar knowledge in other systems (e.g. JIRA) acceptable.\n- Experience in wireframing tools such as Adobe XD or Figma.\n- Experience in writing Wikis.\n- Power BI and Data Analytics capabilities.", "responsibilities": "Not specified", "qualifications": {"required": "Not specified", "preferred": "Not specified"}, "skills": ["HTML", "CSS", "JavaScript", "SQL Server", "Microsoft Office", "Swagger", "Postman", "Adobe XD", "Figma", "Power BI", "Data Analytics"], "postedDate": "3 months ago", "applicationDeadline": "Not specified", "benefits": "Not specified", "remoteWork": "Not specified", "url": "https://www.linkedin.com/jobs/view/3929233697"}