{"jobTitle": "Showroom Manager/Assistant Designer", "company": {"name": "Shalena Smith Interiors & Gaga Designs", "location": "Los Angeles, CA"}, "location": "Los Angeles, CA", "jobType": "Full-time", "employmentType": "Full-time", "experienceLevel": "Entry level", "salary": {"amount": "50,000.00/yr - 65,000.00/yr", "currency": "USD"}, "jobFunction": "Sales and Business Development", "description": "Shalena Smith Interiors seeks an outgoing Showroom Manager/Assistant Designer (full-time) to join our team in Porter Ranch, CA. Must be experienced in sales and passionate about people & design. The ideal candidate is a motivated, self- starter, energetic, creative, and understands design aesthetics.\n\nWe offer a competitive salary plus commission & bonus, healthcare stipend, mileage reimbursements, and a beautiful working environment located at The Vineyards Porter Ranch, where you can live your dream of designing luxury homes.\n\nThe role involves a range of responsibilities that support our Principal Designer and our Retail Showroom.\n\nQUALIFICATIONS\n\u2022 Bachelor's Degree in Interior Design or experience equivalent (3-5yrs) (preferred)\n\u2022 1+ years experience working in the residential design field preferred\n\u2022 Minimum of 2 years retail sales experience\n\u2022 Proficiency in AutoCAD, Sketchup, or similar programs is required. Knowledge of Mac Applications, Design Files, Adobe Suite (Photoshop, InDesign, Illustrator), Sketchup, Google Workspace, and Canva\n\u2022 Valid driver's license with reliable transportation\n\nJOB REQUIREMENTS\n\u2022 Ability to lift small to medium items up to 25 lbs.\n\u2022 Use of AutoCAD and/or SketchUp\n\u2022 Use of computer programs such as Canva, Google WorkSpace, Adobe, Design Files, and various Mac Applications\n\u2022 Use of Clover as a POS\n\u2022 Understanding of basic social media operations\n\u2022 Ability to work extended hours on occasion for project installs & showroom meetings\n\u2022 Ability to travel locally & out of State for design shows.\n\nESSENTIAL FUNCTIONS include but are not limited to:\n\u2022 Assist the Principal Designer with various design and administrative tasks related to all phases of luxury residential design from initial onboarding through project completion.\n\u2022 Gather detailed information, finish samples, specifications, and quotes for preparation of accurate design proposals including occasional sample and material pick-ups\n\u2022 Assist with product sourcing\n\u2022 Assist with preparing client presentations\n\u2022 Point of contact communications for clients and contractors\n\u2022 Maintain project information such as orders, quotes, and any other client- related information\n\u2022 Maintain inventory and restock shelves as needed\n\u2022 Assist in-store visual merchandising\n\u2022 Assist in meeting monthly sales goals through relationship-based selling\n\u2022 Build strong customer relationships to create a repeat sales business\n\u2022 Sales experience is a must since our showroom is a retail establishment. Vibrant personality, self-starter, and passionate about attracting new clients\n\nKNOWLEDGE, SKILLS AND ABILITIES\n\u2022 Detail-oriented, organized, accurate, and consistent in all paperwork and data management\n\u2022 Creative problem-solving, organizational, and time management skills\n\u2022 Clear and concise communication skills, both verbal and written\n\u2022 Ability to interact with design clients, retail customers, vendors, reps, and construction workers in a professional manner\n\u2022 Willingness to observe company policies, procedures, and the instructions of the Principal Designer\n\u2022 Demonstrate the ability to take direction\n\u2022 Ability to work independently and manage up \u2022 Team player with a positive can-do attitude\n\u2022 Flexibility, resourcefulness & dependability\n\u2022 Confidence and assertiveness\n\nABOUT THE OPPORTUNITY\nWorking with the Principal Designer, the Assistant Designer acts as administrative and design support on all phases of high-end, residential interior design projects. This full-time position requires retail sales experience, knowledge of interior design, and a solid ability to organize information, manage time and documentation, and follow through on assignments under strict deadlines.\n\nTO APPLY:\nEmail resume & portfolio to hiring@shalenasmith.com (No phone calls or walk-ins)", "responsibilities": "Assist the Principal Designer with various design and administrative tasks related to all phases of luxury residential design from initial onboarding through project completion.\nGather detailed information, finish samples, specifications, and quotes for preparation of accurate design proposals including occasional sample and material pick-ups\nAssist with product sourcing\nAssist with preparing client presentations\nPoint of contact communications for clients and contractors\nMaintain project information such as orders, quotes, and any other client- related information\nMaintain inventory and restock shelves as needed\nAssist in-store visual merchandising\nAssist in meeting monthly sales goals through relationship-based selling\nBuild strong customer relationships to create a repeat sales business\nSales experience is a must since our showroom is a retail establishment. Vibrant personality, self-starter, and passionate about attracting new clients", "qualifications": {"required": "Ability to lift small to medium items up to 25 lbs.\nUse of AutoCAD and/or SketchUp\nUse of computer programs such as Canva, Google WorkSpace, Adobe, Design Files, and various Mac Applications\nUse of Clover as a POS\nUnderstanding of basic social media operations\nAbility to work extended hours on occasion for project installs & showroom meetings\nAbility to travel locally & out of State for design shows.", "preferred": "Bachelor's Degree in Interior Design or experience equivalent (3-5yrs)\n1+ years experience working in the residential design field preferred\nMinimum of 2 years retail sales experience"}, "skills": ["AutoCAD", "Sketchup", "Mac Applications", "Design Files", "Adobe Suite", "Photoshop", "InDesign", "Illustrator", "Google Workspace", "Canva", "Sales", "Interior Design", "Retail"], "postedDate": "1 week ago", "benefits": "competitive salary plus commission & bonus, healthcare stipend, mileage reimbursements, and a beautiful working environment located at The Vineyards Porter Ranch", "remoteWork": "No", "url": "https://www.linkedin.com/jobs/view/3988639207"}