{"jobTitle": "Chief of Staff", "company": {"name": "Nuey Aesthetics", "location": "Los Angeles, CA", "industry": "Wellness and Fitness Services"}, "location": "Los Angeles, CA", "jobType": "Full-time", "employmentType": "Full-time", "experienceLevel": "Executive", "jobFunction": "Administrative", "description": "Job Description: Chief of Staff\nLocation: Los Angeles, CA\nCompany: Nuey Aesthetics (\u201cNuey\u201d)\nAbout Us:\nNuey is one of the few well-capitalized medspa concepts engineered to optimize unit economics and achieve sustainable growth by merging expert practitioners, hospitality-driven design & service, and targeted digital marketing campaigns. With a strong focus on helping our clients achieve graceful aging, we aim to redefine beauty enhancement through unrivaled expertise and trust. As the premier destination for today\u2019s most discerning clients, Nuey blends cutting-edge techniques with a guest-centric philosophy. Our elite team of providers, holistic approach, and unwavering commitment to personalized care position us as the trusted partner in one\u2019s lifelong journey of skin health. Here, we strive to set a new standard in aesthetic care that blends advanced science with individual needs at every age, and every stage.\nPosition Overview:\nAs the Chief of Staff, you will have unrivaled access to executive leadership, playing a critical role in supporting all aspects of business operations, strategic planning, and execution. The Chief of Staff will act as a trusted advisor to the executive team, ensuring that strategic initiatives are implemented effectively and are aligned with the company's goals. The Chief of Staff role is designed to provide significant opportunities for career advancement. Applicants should have the capabilities to one day be a leader at Nuey, overseeing important business functions.\nKey Responsibilities:\n* Strategic Planning and Execution: Assist the executive team in developing and executing the company\u2019s strategic initiatives. This includes leading new store openings and being point person with various third parties.\n* Communication: Serve as a liaison between the executive team and various stakeholders, including key employees, advisors, investors, vendors and other third-party relationships. Ensure clear and effective communication of the executive team's vision and priorities.\n* Confidential Support: Handle sensitive and confidential information with the utmost discretion and professionalism given the unfiltered access to executive leadership.\n* Meeting Preparation: Prepare agendas, presentations, and materials for executive meetings. Attend meetings with the executive team and track action items and follow-ups.\n* Research and Data Analysis: Analyze business performance data and provide insights and recommendations to the executive team to drive growth and profitability.\n* Special Projects: Take on special projects and initiatives as directed by the executive team, providing leadership and support to ensure successful outcomes.\nQualifications:\n* Experience: 2-6 years of experience in consulting, startups, technology, investment banking, or accounting.\n* Skills:\n* Proven project management skills with the ability to manage multiple priorities and deadlines.\n* Excellent written and verbal communication skills.\n* Highly analytical with problem-solving abilities.\n* Ability to work independently and as part of a team in a fast-paced, dynamic environment.\n* Proficiency in Microsoft Office Suite (Excel, PowerPoint, Word).\n* Personal Attributes:\n* Operate with integrity and professionalism.\n* Strong work ethic and willingness to take on any assignment.\n* Good interpersonal skills and the ability to build relationships with stakeholders at all levels.\n* Proactive, self-starter with a strong sense of urgency and attention to detail.\n* Flexibility and adaptability to changing priorities and business needs.\nWhy Join Us:\n* Be part of a fast-growing, innovative company that is transforming the medspa industry.\n* Work closely with executives on most important strategic initiatives.\n* Opportunity for professional growth, development and upward mobility.\n* Competitive compensation and benefits.\n\nNuey is an equal opportunity employer and welcomes candidates from diverse backgrounds to apply.", "responsibilities": "As the Chief of Staff, you will have unrivaled access to executive leadership, playing a critical role in supporting all aspects of business operations, strategic planning, and execution. The Chief of Staff will act as a trusted advisor to the executive team, ensuring that strategic initiatives are implemented effectively and are aligned with the company's goals. The Chief of Staff role is designed to provide significant opportunities for career advancement. Applicants should have the capabilities to one day be a leader at Nuey, overseeing important business functions.\n* Strategic Planning and Execution: Assist the executive team in developing and executing the company\u2019s strategic initiatives. This includes leading new store openings and being point person with various third parties.\n* Communication: Serve as a liaison between the executive team and various stakeholders, including key employees, advisors, investors, vendors and other third-party relationships. Ensure clear and effective communication of the executive team's vision and priorities.\n* Confidential Support: Handle sensitive and confidential information with the utmost discretion and professionalism given the unfiltered access to executive leadership.\n* Meeting Preparation: Prepare agendas, presentations, and materials for executive meetings. Attend meetings with the executive team and track action items and follow-ups.\n* Research and Data Analysis: Analyze business performance data and provide insights and recommendations to the executive team to drive growth and profitability.\n* Special Projects: Take on special projects and initiatives as directed by the executive team, providing leadership and support to ensure successful outcomes.", "qualifications": {"required": "2-6 years of experience in consulting, startups, technology, investment banking, or accounting.\n* Proven project management skills with the ability to manage multiple priorities and deadlines.\n* Excellent written and verbal communication skills.\n* Highly analytical with problem-solving abilities.\n* Ability to work independently and as part of a team in a fast-paced, dynamic environment.\n* Proficiency in Microsoft Office Suite (Excel, PowerPoint, Word).", "preferred": "Operate with integrity and professionalism.\n* Strong work ethic and willingness to take on any assignment.\n* Good interpersonal skills and the ability to build relationships with stakeholders at all levels.\n* Proactive, self-starter with a strong sense of urgency and attention to detail.\n* Flexibility and adaptability to changing priorities and business needs."}, "skills": ["Project Management", "Communication", "Problem Solving", "Microsoft Office Suite", "Excel", "PowerPoint", "Word"], "postedDate": "5 days ago", "benefits": "Competitive compensation and benefits.", "remoteWork": "No", "url": "https://www.linkedin.com/jobs/view/3999626676"}