{"jobTitle": "Director of Operations", "company": {"name": "UNIS", "location": "Buena Park, CA"}, "location": "Buena Park, CA", "jobType": "Full-time", "employmentType": "Full-time", "experienceLevel": "Director", "salary": {"amount": "$145,000.00/yr - $155,000.00/yr", "currency": "USD"}, "jobFunction": "General Business and Management", "industry": "Transportation, Logistics, Supply Chain and Storage", "description": "3PL Director of Operations will develop business strategies and to support and maintain accounts for logistics services. The ideal person will have experience in the 3PL space and existing network. This person will manage a group of General Managers and collaborate cross-functionally to ensure successful onboarding and maintenance of accounts.\n\nProvides input to strategic decisions that affect the functional area of responsibility. May give input into developing the budget. Capable of resolving escalated issues arising from operations and requiring coordination with other departments.\n\n<br/>\n\n**Job Description**:\n\n* Develop and execute strategies to generate profitable revenue on client-centric product solutions.\n* Maintain strong pulse on market trends, competition, and client feedback.\n* Collaborate cross-functionally to anticipate and solve development and integration challenges.\n* Build and lead a team to meet or exceed established goals.\n* Negotiates fees, closes sales orders and obtain signed contracts with pricing approval.\n* Understands the communication needs of small, medium, and large sized business customers, and designs solutions to meet those unique business needs.\n* Develop business insights and help influence key stakeholders with data-driven decision making.\n* Reviews accounts periodically to ensure profitability, adjusts fees and pricing structures as required.\n* Travels throughout assigned territory for site visits and in person meetings.\n* Identify arising business opportunities and build long-lasting trusted relationships of prospective accounts.\n* Understand and support the goals, policies, and procedures of company.\n\n<br/>\n\n**Job Requirements**:\n\n* Bachelor's degree or equivalent in any field\n* 10+ years of logistics sales/operation experience.\n* Proficient account management, acquisition, upselling, and development skills\n* Proficient knowledge on warehouse management system, order management system, transportation management systems and services/products related to supply chain industry.\n* Proficient knowledge of Microsoft word, Excel, and PowerPoint.\n* Excellent communication skills; proven written and oral presentation skills, and strong interpersonal skills.\n* High level of integrity and ability to work with confidential information required.\n* Demonstrated time and project management skills.\n* Available to work full-time and as needed in evenings and on weekends.\n* Solid track record of over-achieving on sales targets.\n* Requires high energy, self-motivated, enthusiastic, ambitious, goal-oriented, and success driven.\n* Able to oversee multiple facilities operationally, P&L, quality, and SLA performance.\n* Food grade or beverage is helpful\n* High volume Ecommerce experience is helpful.\n* Able to interface with demanding customer on-site.\n* Able to make quick and precise decisions\n* Proficient in labor management planning and execution.\n* Able to direct staffing requirements to OM\u2019s and supervisors.\n* Good follow up skills\n* Able to multi task through changing environments\n\n", "responsibilities": "3PL Director of Operations will develop business strategies and to support and maintain accounts for logistics services. The ideal person will have experience in the 3PL space and existing network. This person will manage a group of General Managers and collaborate cross-functionally to ensure successful onboarding and maintenance of accounts.\n\nProvides input to strategic decisions that affect the functional area of responsibility. May give input into developing the budget. Capable of resolving escalated issues arising from operations and requiring coordination with other departments.", "qualifications": {"required": "Bachelor's degree or equivalent in any field\n10+ years of logistics sales/operation experience.\nProficient account management, acquisition, upselling, and development skills\nProficient knowledge on warehouse management system, order management system, transportation management systems and services/products related to supply chain industry.\nProficient knowledge of Microsoft word, Excel, and PowerPoint.\nExcellent communication skills; proven written and oral presentation skills, and strong interpersonal skills.\nHigh level of integrity and ability to work with confidential information required.\nDemonstrated time and project management skills.\nAvailable to work full-time and as needed in evenings and on weekends.\nSolid track record of over-achieving on sales targets.\nRequires high energy, self-motivated, enthusiastic, ambitious, goal-oriented, and success driven.\nAble to oversee multiple facilities operationally, P&L, quality, and SLA performance.\nFood grade or beverage is helpful\nHigh volume Ecommerce experience is helpful.\nAble to interface with demanding customer on-site.\nAble to make quick and precise decisions\nProficient in labor management planning and execution.\nAble to direct staffing requirements to OM\u2019s and supervisors.\nGood follow up skills\nAble to multi task through changing environments"}, "skills": ["Logistics", "Sales", "Account Management", "Warehouse Management", "Order Management", "Transportation Management", "Supply Chain", "Microsoft Word", "Excel", "PowerPoint", "Communication", "Presentation Skills", "Interpersonal Skills", "Project Management", "Time Management", "Ecommerce", "Customer Service", "Labor Management"], "postedDate": "1 week ago", "benefits": "Medical insurance, Vision insurance, Dental insurance, 401(k), Disability insurance", "remoteWork": "No", "url": "https://www.linkedin.com/jobs/view/4000518480"}