{"jobTitle": "Human Resources Business Partner", "company": {"name": "Bain & Company", "location": "Los Angeles, CA"}, "location": "Los Angeles, CA", "jobType": "Full-time", "employmentType": "Full-time", "experienceLevel": "Not Applicable", "salary": {"amount": "$110,000.00/yr - $144,000.00/yr", "currency": "USD"}, "jobFunction": "Human Resources", "industry": "Business Consulting and Services", "description": "WHAT MAKES US A GREAT PLACE TO WORKWe are proud to be consistently recognized as one of the world\u2019s best places to work, a champion of diversity and a model of social responsibility. We are currently #1 ranked consulting firm on Glassdoor\u2019s Best Places to Work list and have maintained a spot in the top four on Glassdoor\u2019s list for the last 13 years. We believe that diversity, inclusion and collaboration is key to building extraordinary teams. We hire people with exceptional talents, abilities and potential, then create an environment where you can become the best version of yourself and thrive both professionally and personally. We are publicly recognized by external parties such as Fortune, Vault, Mogul, Working Mother, Glassdoor and the Human Rights Campaign for being a great place to work for diversity and inclusion, women, LGBTQ and parents.\u00a0WHO YOU\u2019LL WORK WITHA\u00a0talent and human resources job at Bain can prepare you for anything that follows in your career. Here, people are our single greatest asset and the entire company\u2019s success hinges on your capacity to find, develop, and guide those talented people. That means we'll entrust you with the resources you need to craft an inclusive and sustainable team, and to contribute to the culture we know leads to great work.WHERE YOU\u2019LL FIT WITHIN THE TEAM\u00a0The HRBP, Global Human Resources will serve as HR generalist for various departments within the Capability Delivery Solutions and Private Equity functions. The successful candidate will be responsible for employee relations, talent strategy, performance management, compensation, operational support, and more. They will help to develop and drive consistent, effective HR policies and talent management programs, collaborating closely with the business lines on professional development, learning/training and employee engagement.\u00a0WHAT YOU\u2019LL DO\u00a080%\u00a0 \u00a0Serve as the HR Business Partner for allocated departments within Capability Delivery Solutions and Private Equity functions:Be on point for the customer group employee lifecycle, including employee relations, performance management, compensation, policy interpretation, risk management, professional development and employee services.Liaise regularly with leadership team, employees, and leadership teams. Develop strong and productive working relationships/high levels of communication with key stakeholders; become known as the \u201cgo to\u201d person for all HR needs for the functions.Provide thought partnership to leadership on talent issues impacting customer group, e.g. employee engagement, organization and role design, etc.Exercise discretion and business judgment to manage all employee relations issues, including performance concerns, team conflicts, grievances, investigations, accommodations, and other matters.With guidance from Global HR Program team and support from Specialist, lead efficient and effective performance review and compensation review processes.Train and develop program management team on best practices for risk management, performance management, and facilitating difficult conversations.Work with the employee relations and in-house legal teams to educate/advise management as necessary; playa leadership role in investigations and resulting decision-making.Collaborate with the Business and Experienced Talent Recruiting to support hiring needs and effective on-boarding and integration processes.Collaborate with global compensation team on compensation needs for the function, including educating line managers and employees on Bain\u2019s compensation philosophy and relevant compensation structures.Be a champion and thought partner to drive DEI initiatives within CDS and Private Equity.Manage, coach and develop direct report.10%\u00a0 \u00a0Actively contribute to the broader Global HR team:Liaise regularly with other HR Business Partners/HR generalists within the Global Talent Management team to ensure consistency and sharing of best practicesParticipate in project teams by supporting roll-out and repeatability efforts, population analysis, and cross-office/functional coordination.10% \u00a0 \u00a0Other duties assigned as position or circumstances dictateABOUT YOUEducationRequiredBachelor\u2019s degree or an equivalent combination of education, training and/or experience is requiredExperience\u00a0RequiredMinimum 5-8 years of professional work experience in HRMinimum 5 years direct employee relations experience in a professional organizationPreferredMinimum 2 years of experience as an HR Generalist/Business PartnerKnowledge, Skills, and AttributesRequiredHigh level of customer focus and business acumenDemonstrated ability to exercise effective judgment, sensitivity, discretion, and creativity in changing needs and situationsSignificant experience in employee relations with proven record of mitigating employee riskExperience working in a matrix environment where collaboration is key in providing exceptional resultsExcellent communication (written and verbal), interpersonal and problem solving skillsSelf-starter with strong organization skills - ability to meet deadlines, prioritize assignments, and juggle multiple tasks simultaneously in a fast-paced, customer-focused environmentDemonstrated success acting as management advisor in areas involving complex employee issues (e.g., performance/employee relations/organizational issues)Success working in dynamic, fast-paced environmentsWillingness to participate on calls across time zones as neededProven ability to work both independently and as part of a teamSome travel required (estimated to be once or twice yearly)U.S. Compensation Information Compensation for this role includes base salary, annual discretionary performance bonus, 401(k) plan with an annual employer contribution based on years of service and Bain\u2019s best in class benefits package (details listed below).\u00a0Some local governments in the United States require a good-faith, reasonable salary range be included in job postings for open roles. The estimated annualized compensation for this role is as follows: \u00a0In New York City, the good-faith, reasonable annualized full-time salary range for this role is between $119,500- $144,000 placement within this range will vary based on several factors including, but not limited to experience, education, licensure/certifications, training and skill level\u00a0In California state, the good-faith, reasonable annualized full-time salary range for this role is between $110,000 - $144,000 placement within this range will vary based on several factors including, but not limited to experience, education, licensure/certifications, training and skill level\u00a0In Washington state and Washington D.C, the good-faith, reasonable annualized full-time salary range for this role is between $110,000 - $132,500 placement within this range will vary based on several factors including, but not limited to experience, education, licensure/certifications, training and skill level\u00a0For all other locations, the good-faith, reasonable annualized full-time salary range for this role is commensurate with competitive geographic market rates for this role and will vary based on several factors including, but not limited to experience, education, licensure/certifications, training and skill level\u00a0Annual discretionary performance bonus \u00a0This role may also be eligible for other elements of discretionary compensation\u00a0\u2022 4.5% 401(k) company contribution, which increases after 3 years of service and is 100% vested upon start date\u00a0\u2022 Bain & Company's comprehensive benefits and wellness program is designed to help employees achieve personal independence, protection and stability in the areas most important to you and your family.\u00a0\u2022 Bain pays 100% individual employee premiums for medical, dental and vision programs, offering one of the most comprehensive medical plans for employees without impacting your paycheck\u00a0\u2022 Generous paid time off, including parental leave, sick leave and paid holidays\u00a0\u2022 Fully vested 401(k) company contribution\u00a0\u2022 Paid Life and Long-Term Disability insurance\u00a0\u2022 Annual fitness reimbursements", "responsibilities": "Serve as the HR Business Partner for allocated departments within Capability Delivery Solutions and Private Equity functions:Be on point for the customer group employee lifecycle, including employee relations, performance management, compensation, policy interpretation, risk management, professional development and employee services.Liaise regularly with leadership team, employees, and leadership teams. Develop strong and productive working relationships/high levels of communication with key stakeholders; become known as the \u201cgo to\u201d person for all HR needs for the functions.Provide thought partnership to leadership on talent issues impacting customer group, e.g. employee engagement, organization and role design, etc.Exercise discretion and business judgment to manage all employee relations issues, including performance concerns, team conflicts, grievances, investigations, accommodations, and other matters.With guidance from Global HR Program team and support from Specialist, lead efficient and effective performance review and compensation review processes.Train and develop program management team on best practices for risk management, performance management, and facilitating difficult conversations.Work with the employee relations and in-house legal teams to educate/advise management as necessary; playa leadership role in investigations and resulting decision-making.Collaborate with the Business and Experienced Talent Recruiting to support hiring needs and effective on-boarding and integration processes.Collaborate with global compensation team on compensation needs for the function, including educating line managers and employees on Bain\u2019s compensation philosophy and relevant compensation structures.Be a champion and thought partner to drive DEI initiatives within CDS and Private Equity.Manage, coach and develop direct report.Actively contribute to the broader Global HR team:Liaise regularly with other HR Business Partners/HR generalists within the Global Talent Management team to ensure consistency and sharing of best practicesParticipate in project teams by supporting roll-out and repeatability efforts, population analysis, and cross-office/functional coordination.Other duties assigned as position or circumstances dictate", "qualifications": {"required": "Bachelor\u2019s degree or an equivalent combination of education, training and/or experience is requiredMinimum 5-8 years of professional work experience in HRMinimum 5 years direct employee relations experience in a professional organizationHigh level of customer focus and business acumenDemonstrated ability to exercise effective judgment, sensitivity, discretion, and creativity in changing needs and situationsSignificant experience in employee relations with proven record of mitigating employee riskExperience working in a matrix environment where collaboration is key in providing exceptional resultsExcellent communication (written and verbal), interpersonal and problem solving skillsSelf-starter with strong organization skills - ability to meet deadlines, prioritize assignments, and juggle multiple tasks simultaneously in a fast-paced, customer-focused environmentDemonstrated success acting as management advisor in areas involving complex employee issues (e.g., performance/employee relations/organizational issues)Success working in dynamic, fast-paced environmentsWillingness to participate on calls across time zones as neededProven ability to work both independently and as part of a teamSome travel required (estimated to be once or twice yearly)", "preferred": "Minimum 2 years of experience as an HR Generalist/Business Partner"}, "skills": ["Employee Relations", "Talent Management", "Performance Management", "Compensation", "Risk Management", "Professional Development", "Employee Services", "Communication", "Interpersonal Skills", "Problem Solving", "Organization", "Management", "Collaboration", "DEI"], "postedDate": "1 week ago", "benefits": "Compensation for this role includes base salary, annual discretionary performance bonus, 401(k) plan with an annual employer contribution based on years of service and Bain\u2019s best in class benefits package (details listed below).\u00a0Some local governments in the United States require a good-faith, reasonable salary range be included in job postings for open roles. The estimated annualized compensation for this role is as follows: \u00a0In New York City, the good-faith, reasonable annualized full-time salary range for this role is between $119,500- $144,000 placement within this range will vary based on several factors including, but not limited to experience, education, licensure/certifications, training and skill level\u00a0In California state, the good-faith, reasonable annualized full-time salary range for this role is between $110,000 - $144,000 placement within this range will vary based on several factors including, but not limited to experience, education, licensure/certifications, training and skill level\u00a0In Washington state and Washington D.C, the good-faith, reasonable annualized full-time salary range for this role is between $110,000 - $132,500 placement within this range will vary based on several factors including, but not limited to experience, education, licensure/certifications, training and skill level\u00a0For all other locations, the good-faith, reasonable annualized full-time salary range for this role is commensurate with competitive geographic market rates for this role and will vary based on several factors including, but not limited to experience, education, licensure/certifications, training and skill level\u00a0Annual discretionary performance bonus \u00a0This role may also be eligible for other elements of discretionary compensation\u00a0\u2022 4.5% 401(k) company contribution, which increases after 3 years of service and is 100% vested upon start date\u00a0\u2022 Bain & Company's comprehensive benefits and wellness program is designed to help employees achieve personal independence, protection and stability in the areas most important to you and your family.\u00a0\u2022 Bain pays 100% individual employee premiums for medical, dental and vision programs, offering one of the most comprehensive medical plans for employees without impacting your paycheck\u00a0\u2022 Generous paid time off, including parental leave, sick leave and paid holidays\u00a0\u2022 Fully vested 401(k) company contribution\u00a0\u2022 Paid Life and Long-Term Disability insurance\u00a0\u2022 Annual fitness reimbursements", "remoteWork": "No", "url": "https://www.linkedin.com/jobs/view/4000731904"}