{"jobTitle": "Operations Associate - Alternative Investments", "company": {"name": "Manhattan West", "location": "Los Angeles, CA"}, "location": "Los Angeles, CA", "jobType": "Full-time", "employmentType": "Full-time", "experienceLevel": "Associate", "salary": {"amount": "75,000.00/yr - 90,000.00/yr", "currency": "USD"}, "jobFunction": "Administrative, General Business, and Finance", "industry": "Financial Services", "description": "Manhattan West Enterprise Company (\u201cManhattan West\u201d) is seeking an Operations Associate to join our alternative investments team. This is an excellent opportunity to join a modern and fast-growing investment firm that provides proprietary alternative investments across multiple asset classes including Venture Capital, Private Equity, Real Estate, Private Debt, and traditional equity and fixed income portfolios, as well as financial services including wealth management, business management, tax, and insurance services.\n\nThis position will primarily be responsible for the administrative and client support functions of our alternative investments, with a particular focus on supporting our Late-Stage Venture (pre-IPO companies) efforts.\n\nAbout this Position:\n\n* Located at Manhattan West\u2019s office in Century City, Los Angeles, CA\n* Full-time, exempt with 3 days in the office and 2 days remote\n* Reports to the Executive Director of Venture Capital and the Director of Operations\n\nResponsibilities:\n\n* Play an integral role in investment transactions from start to finish\n* Perform administrative duties that support the team in daily business practices, including but not limited to the following.\n* Prepare subscription documents\n* Process and track wires\n* Manage prospect and client communications\n* Manage and update the client and prospective investor database\n* Manage the finances of our funds and Special Purpose Vehicles (\u201cSPVs\u201d)\n* Manage and update our data room\n* Facilitate Nondisclosure agreements\n* Assist in fund or entity formation documents\n* Assist with audit and related audit confirmations\n* Assist with special projects, such as business development, investor relations, preparing marketing materials, etc. an as-needed basis\n* Communicate with our third-party service providers\n* Review agreements and other documents associated with potential investments and coordinate with our legal and compliance teams\n* Update and maintain capital tables\n* Assist with investor distributions\n\nSkills:\n\n* Must have attention-to-detail, project management skills and the ability to work efficiently on multiple transactions at once under tight deadlines\n* Must possess a professional demeanor, have a strong work ethic and be highly self-motivated with the ability to work independently as well as in a team setting\n* Ability to prioritize workload and shift attention among quickly changing priorities\n* Ability to communicate complex matters concisely and effectively in oral and written form\n* Excellent communication, presentation, time-management, and organizational skills\n\nRequirements:\n\n* Bachelor\u2019s degree from an accredited 4-year institution\n* 1-3 years of relevant experience in Client Services or relevant Financial Industry\n* Expertise in Microsoft Office and DocuSign\n* Must be legally authorized to work in the United States\n* Successful completion of background check and pre-employment assessments\n* Ability to complete the essential functions of the job with or without reasonable accommodation\n* Preferences:\n* Alternative investments (venture, private equity, private credit, etc.) experience\n* Orion wealth management software experience\n* DocuSign experience\n* Pitchbook experience\n\nCompensation:\n\n* Salary range $75,000 - $90,000 based on qualifications and experience\n* Discretionary bonus\n\nFeatured Benefits:\n\n* Medical, vision and dental insurance\n* 401(k) profit sharing plan\n* Stock market holidays + Paid time off (PTO)\n* Other fringe benefits as are made available to other similarly situated employees\n\nManhattan West is an equal opportunity employer and complies with all applicable federal, state, and local fair employment practices laws. Manhattan West is committed to hiring practices that are free from unlawful discrimination. Manhattan West strictly prohibits and does not tolerate unlawful discrimination against employees, applicants, or any other covered persons, including interns, by co-workers, supervisors, managers, or third parties on the basis of a person's race, color, age (40 or older), religious creed, religious belief, observance, and practice, dress or grooming practices, national origin, ancestry, physical disability, mental disability, medical condition including any cancer-related physical or mental health impairment from a diagnosis, record, or history of cancer, a genetic characteristic genetic information including information about an individual's genetic tests, family members' genetic tests, family members' diseases or disorders, an individual's or family member's receipt of, or request for, genetic services, participation by an individual or their family member in clinical research that includes genetic services, marital status, sex, pregnancy, childbirth, breast feeding, medical conditions related to pregnancy, childbirth, or breast feeding, gender, gender expression, meaning a person's gender-related appearance or behavior, the perception of such appearance or behavior, whether or not stereotypically associated with the person's sex at birth, gender identity, meaning a person's internal understanding of their gender, or the perception of a person's gender identity, which may include male, female, a combination of male and female, neither male or female, a gender different from the person's sex assigned at birth, or transgender, sexual orientation including heterosexuality, homosexuality, bisexuality, military or veteran status, including past, current, or prospective service in the uniformed services, or any other characteristic protected under applicable federal, state, or local law.", "responsibilities": "Play an integral role in investment transactions from start to finish\nPerform administrative duties that support the team in daily business practices, including but not limited to the following.\nPrepare subscription documents\nProcess and track wires\nManage prospect and client communications\nManage and update the client and prospective investor database\nManage the finances of our funds and Special Purpose Vehicles (\u201cSPVs\u201d)\nManage and update our data room\nFacilitate Nondisclosure agreements\nAssist in fund or entity formation documents\nAssist with audit and related audit confirmations\nAssist with special projects, such as business development, investor relations, preparing marketing materials, etc. an as-needed basis\nCommunicate with our third-party service providers\nReview agreements and other documents associated with potential investments and coordinate with our legal and compliance teams\nUpdate and maintain capital tables\nAssist with investor distributions", "qualifications": {"required": "Must have attention-to-detail, project management skills and the ability to work efficiently on multiple transactions at once under tight deadlines\nMust possess a professional demeanor, have a strong work ethic and be highly self-motivated with the ability to work independently as well as in a team setting\nAbility to prioritize workload and shift attention among quickly changing priorities\nAbility to communicate complex matters concisely and effectively in oral and written form\nExcellent communication, presentation, time-management, and organizational skills", "preferred": "Alternative investments (venture, private equity, private credit, etc.) experience\nOrion wealth management software experience\nDocuSign experience\nPitchbook experience"}, "skills": ["Microsoft Office", "DocuSign", "Client Services", "Financial Industry", "Project Management", "Communication", "Presentation", "Time Management", "Organizational Skills", "Alternative Investments", "Venture Capital", "Private Equity", "Private Credit", "Orion Wealth Management", "Pitchbook"], "postedDate": "3 days ago", "benefits": "Medical, vision and dental insurance\n401(k) profit sharing plan\nStock market holidays + Paid time off (PTO)\nOther fringe benefits as are made available to other similarly situated employees", "remoteWork": "Yes", "url": "https://www.linkedin.com/jobs/view/4002108700"}