{"jobTitle": "Warehouse Supervisor", "company": {"name": "Action Staffing Group", "location": "Simi Valley, CA"}, "location": "Simi Valley, CA", "jobType": "Full-time", "employmentType": "Full-time", "experienceLevel": "Mid-Senior level", "jobFunction": "Management", "industry": "Manufacturing", "description": "Our manufacturing client is seeking a Warehouse Supervisor to join their team at their facility in Chatsworth, CA. The ideal candidate will oversee the daily operations of the warehouse, ensuring efficiency, accuracy, and safety in all processes.\n\nThe Warehouse Supervisor will lead a team and oversee all warehouse operations; this includes material handling, receiving, kitting, and shipping. This role will provide hands-on supervision while motivating, leading by example, and exercising a positive team-building atmosphere. The successful candidate will continuously improve all, inbound, outbound, and internal material movement.\n\nMonday-Friday, 7:30am-4:30pm\n\nIn November the schedule will shift to Monday - Thursday 10 hour work days, so you will get a 3 day weekend every weekend! \n\nSalary starting at $75,000/year, commensurate with experience\n\nAnnual bonus opportunity\n\nKey Responsibilities:\n\n* Manage the overall operations of the stockrooms\n* Provide guidance, direction, and enhance individual performance through defined expectations, training, coaching, and mentoring of the warehouse team\n* Develop and ensure successful performance against departmental metrics by taking tactical actions or implementing process improvement as needed\n* Establish a high-performing culture, commitment to excellence, and improvement\n* Ensure processes and procedures related to material movement in MRP and outside MRP are enforced and documented\n* Manage company cycle counting procedures and shipment transactions to achieve accuracy of inventory\n* Maintain communication with customers to answer shipping and receiving inquiries and troubleshoot problems\n* Ensures general safety, compliance with relevant legislation, regulations and company requirements\n\nQualifications:\n\n* 4 + years of experience in warehouse management or in a supervisory role in a manufacturing environment\n* Proficiency in Microsoft applications\n* Knowledge and experience in managing inventory and handling procedures\n* Knowledge of carrier portals such as UPS and FedEx.\n* High school diploma or equivalent required\n* Bilingual preferred\n\n", "responsibilities": "Manage the overall operations of the stockrooms, Provide guidance, direction, and enhance individual performance through defined expectations, training, coaching, and mentoring of the warehouse team, Develop and ensure successful performance against departmental metrics by taking tactical actions or implementing process improvement as needed, Establish a high-performing culture, commitment to excellence, and improvement, Ensure processes and procedures related to material movement in MRP and outside MRP are enforced and documented, Manage company cycle counting procedures and shipment transactions to achieve accuracy of inventory, Maintain communication with customers to answer shipping and receiving inquiries and troubleshoot problems, Ensures general safety, compliance with relevant legislation, regulations and company requirements", "qualifications": {"required": "4 + years of experience in warehouse management or in a supervisory role in a manufacturing environment, Proficiency in Microsoft applications, Knowledge and experience in managing inventory and handling procedures, Knowledge of carrier portals such as UPS and FedEx., High school diploma or equivalent required", "preferred": "Bilingual"}, "skills": ["Warehouse Management", "Supervisory", "Manufacturing", "Microsoft Applications", "Inventory Management", "Material Handling", "Shipping", "Receiving", "MRP", "Cycle Counting", "Customer Service", "Safety", "Compliance"], "postedDate": "6 days ago", "benefits": "Salary starting at $75,000/year, commensurate with experience, Annual bonus opportunity", "remoteWork": "No", "url": "https://www.linkedin.com/jobs/view/4002935995"}